{"$schema":"https://json-schema.org/draft/2020-12/schema","$id":"https://mana.local/contracts/mana-inspect/v1/activity.schema.json","type":"object","additionalProperties":false,"required":["schema","events","coverage","diagnostics","guarantees"],"properties":{"schema":{"const":"mana.inspect.activity/v1"},"events":{"type":"array","items":{"type":"object","additionalProperties":false,"required":["event_id","timestamp","event_kind","work_item_id","related_artifact_ids","provenance"],"properties":{"event_id":{"type":"string","minLength":1},"timestamp":{"type":"object","additionalProperties":false,"required":["value","provenance"],"properties":{"value":{"type":"string","minLength":1},"provenance":{"enum":["explicit_domain_timestamp","filesystem_mtime_epoch"]}}},"event_kind":{"enum":["workspace_created","verification_completed","review_recorded","decision_recorded","artifact_updated","unknown"]},"work_item_id":{"anyOf":[{"$ref":"work-items.schema.json#/$defs/workItemId"},{"type":"null"}]},"related_artifact_ids":{"type":"array","items":{"type":"string"}},"summary":{"type":["string","null"]},"provenance":{"$ref":"work-items.schema.json#/$defs/provenance"}}}},"coverage":{"enum":["explicit_structured_events","explicit_and_filesystem_fallback","none","unknown"]},"diagnostics":{"type":"array","items":{"$ref":"work-items.schema.json#/$defs/diagnostic"}},"guarantees":{"$ref":"work-items.schema.json#/$defs/guarantees"}}}
