{"schema":"mana.inspect.activity/v1","events":[{"event_id":"verification:run-1","timestamp":{"value":"2026-05-30T10:15:00Z","provenance":"explicit_domain_timestamp"},"event_kind":"verification_completed","work_item_id":"feature:PROJ-24342","related_artifact_ids":["verification:run-1"],"summary":"Verification completed: passed.","provenance":"explicit_workspace_manifest"},{"event_id":"artifact-update:file:.mana/features/PROJ-24342/evidence/index.md","timestamp":{"value":"1717064100","provenance":"filesystem_mtime_epoch"},"event_kind":"artifact_updated","work_item_id":"feature:PROJ-24342","related_artifact_ids":["file:.mana/features/PROJ-24342/evidence/index.md"],"summary":null,"provenance":"conservative_fallback"}],"coverage":"explicit_and_filesystem_fallback","diagnostics":[],"guarantees":{"model_calls":0,"writes":false,"semantic_inference":"canonical_structured_sources_only"}}
